ID,Sentences,niveau1,niveau2,niveau3_1,niveau3_2,combined_labels,Sentences_clean
148,Je retire mon masque pendant la nuit je le fais inconsciemment et le souci c'est que je me réveille sans masque sur le nez.,partage_experience,traitement,non,NA_CATEGORY,partage_experience_traitement_non_NA_CATEGORY,retire masque pendant nuit fais inconsciemment souci réveille masque nez
375,"Salut oui l'apnée pourris la vie, comme les matins ou te réveillais avec des migraines, puis avec la machine ça allait mieux, résultat en est qu'il faut voir un neurologue car le manque de cerveau oxygéné la nuit provoque des lésions que le neurologue et ORL pourront traiter, une tête qui a besoin de soin, avant de nous prendre pour fou psychiatrique.",partage_experience,symptome,oui,negatif,partage_experience_symptome_oui_negatif,salut oui apnée pourris vie comme matins réveillais migraine puis machine allait mieux résultat faut voir neurologue manque cerveau oxygéné nuit provoque lésions neurologue orl pourront traiter tête a besoin soin avant prendre fou psychiatrique
946,Tout dépend bien sûr de l'état de votre système immunitaire.,partage_experience,diagnostique,non,NA_CATEGORY,partage_experience_diagnostique_non_NA_CATEGORY,tout dépend bien sûr état système immunitaire
308,Il va vous falloir un peu de temps pour vous habituer.,partage_experience,traitement,non,NA_CATEGORY,partage_experience_traitement_non_NA_CATEGORY,va falloir peu temp habituer
416,"J’ai 29 ans, en surpoids de 20 kg, fumeur (20 cig/jour) et assez sédentaire , mon médecin traitant, vu que j’ai de nombreux cas de problèmes cardiaques dans ma famille a un jour décider de m’envoyer chez un cardiologue.",partage_experience,symptome,non,NA_CATEGORY,partage_experience_symptome_non_NA_CATEGORY,NUM an surpoids NUM kg fumeur NUM cig jour assez sédentaire médecin traitant vu nombreux ca problèmes cardiaques famille a jour décider envoyer cardiologue
971,3 semaines ?,recherche_information,diagnostique,non,NA_CATEGORY,recherche_information_diagnostique_non_NA_CATEGORY,NUM semaines
300,"Et pour te répondre sur le physique : oui il y a aussi des gens hyper minces qui sont concernés, donc rien à voir avec le surpoids.",partage_experience,symptome,non,NA_CATEGORY,partage_experience_symptome_non_NA_CATEGORY,répondre physique oui a aussi gen hyper mince concernés rien voir surpoids
667,Peut être faudrait il contacter le dentiste spécialiste de l'orthèse afin de voir avec lui ?,recherche_information,traitement,non,NA_CATEGORY,recherche_information_traitement_non_NA_CATEGORY,peut être faudrait contacter dentiste spécialiste orthèse afin voir
221,"Être appareillé à 14 ans, c'est dur quand même.",partage_experience,traitement,non,NA_CATEGORY,partage_experience_traitement_non_NA_CATEGORY,être appareillé NUM an dur quand
514,J'espère que tu auras un rdv très rapidement.,fonction_phatique,NA_CATEGORY,oui,positif,fonction_phatique_NA_CATEGORY_oui_positif,espère rdv très rapidement
708,"quelqu'un a-t-il une idée, une piste ou un truc semblable que moi ?",recherche_information,diagnostique,non,NA_CATEGORY,recherche_information_diagnostique_non_NA_CATEGORY,quelqu a idée piste truc semblable
938,"Bonjour Docteur, J'ai terminé, mi janvier dernier, mon traitement chimio (3 séances de EC100 et 3 séances de Taxotère) contre un cancer du sein.",partage_experience,traitement,non,NA_CATEGORY,partage_experience_traitement_non_NA_CATEGORY,bonjour docteur terminé mi janvier dernier traitement chimio NUM séances ec NUM NUM séances taxotère contre cancer sein
636,"Et le problème c'est que je suis tellement fatiguée que je mets parfois un moment avant d'avoir le reflex de ""reprendre"" ma respiration (il me faut une tres tres grande inspiration) comme si je restais sous l'eau pendant très longtemps.",partage_experience,symptome,oui,negatif,partage_experience_symptome_oui_negatif,problème tellement fatiguée mets parfois moment avant avoir reflex reprendre respiration faut tres tres grande inspiration comme si restais sou eau pendant très longtemps
209,"Ils pensent peut-être que c'est dû à mes soucis de santé que j'ai eu à la naissance (je suis né par le siège, j'ai eu une hypoxie du cerveau à la naissance, et je prends un traitement hormonal substitutif pour vivre normalement).",partage_experience,traitement,non,NA_CATEGORY,partage_experience_traitement_non_NA_CATEGORY,pensent peut être dû soucis santé naissance né siège hypoxie cerveau naissance prends traitement hormonal substitutif vivre normalement
171,"C'est dingue Jean, tout ce que tu as dû faire pour que tu trouves le bon matos.",partage_experience,traitement,oui,positif,partage_experience_traitement_oui_positif,dingue jean tout a dû faire trouves bon matos
278,Je me demande s’il fallait creuser sur cette piste ou si ça n’a rien à voir...,recherche_information,symptome,non,NA_CATEGORY,recherche_information_symptome_non_NA_CATEGORY,demande fallait creuser cette piste si a rien voir
852,Merci pour votre réponse,fonction_phatique,NA_CATEGORY,non,NA_CATEGORY,fonction_phatique_NA_CATEGORY_non_NA_CATEGORY,merci réponse
652,Même sur le forum de la FFAAIR je n'arrive pas à avoir de solution à ce problème,partage_experience,diagnostique,non,NA_CATEGORY,partage_experience_diagnostique_non_NA_CATEGORY,forum ffaair arrive pa avoir solution problème
268,J’ai été diagnostiquée en médecine interne il y a 3 ans comme ayant un « syndrome de fatigue chronique avec douleurs diffuses ».,partage_experience,symptome,non,NA_CATEGORY,partage_experience_symptome_non_NA_CATEGORY,diagnostiquée médecine interne a NUM an comme syndrome fatigue chronique douleurs diffuses
616,Moi en plus de 4 ans je n'ai jamais eu de soucis et je n'en avais jamais entendu parler...,partage_experience,symptome,non,NA_CATEGORY,partage_experience_symptome_non_NA_CATEGORY,plus NUM an jamais soucis jamais entendu parler
613,Merci par avance cela m'aidera grandement à aller mieux.,fonction_phatique,NA_CATEGORY,oui,positif,fonction_phatique_NA_CATEGORY_oui_positif,merci avance cela aidera grandement aller mieux
543,Mais depuis La Fatigue Est revenu avec les problèmes de concentration et l'impression que ça tourne...,partage_experience,symptome,oui,negatif,partage_experience_symptome_oui_negatif,depuis fatigue revenu problèmes concentration impression tourne
271,C’est évidemment très handicapant...,partage_experience,symptome,oui,negatif,partage_experience_symptome_oui_negatif,évidemment très handicapant
82,"par contre, je ne fume pas, ne boit pas d'alcool.",partage_experience,symptome,non,NA_CATEGORY,partage_experience_symptome_non_NA_CATEGORY,contre fume pa boit pa alcool
380,sommeil non réparateur...,partage_experience,symptome,non,NA_CATEGORY,partage_experience_symptome_non_NA_CATEGORY,sommeil non réparateur
333,"C’est très difficile, je n’arrive pas à m’endormir avec et je me dit que vu que je ne l’ai pas supporté la première fois, je n’y arriverais pas cette fois non plus.",partage_experience,symptome,oui,negatif,partage_experience_symptome_oui_negatif,très difficile arrive pa endormir dit vu pa supporté première fois arriverais pa cette fois non plus
108,"La plupart y arrivent cependant, après quelques essais, en changeant parfois le type de masque.",partage_experience,diagnostique,non,NA_CATEGORY,partage_experience_diagnostique_non_NA_CATEGORY,plupart arrivent cependant après quelques essais changeant parfois type masque
677,"Merci de me faire part de votre experience et de me dire si vous aussi vous ressentez une gêne plus ou moins forte, durant la journée, au niveau des poumons.",recherche_information,symptome,non,NA_CATEGORY,recherche_information_symptome_non_NA_CATEGORY,merci faire part experience dire si aussi ressentez gêne plus moins forte durant journée niveau poumons
339,"La première semaine, j’ai bien cru que je n’y arriverai jamais, d’autant que je dormais encore moins bien qu’avant et que j’étais très fatiguée.",partage_experience,traitement,non,NA_CATEGORY,partage_experience_traitement_non_NA_CATEGORY,première semaine bien cru arriverai jamais autant dormais encore moins bien avant très fatiguée
182,J'ai le même soucis depuis un moment.,partage_experience,symptome,non,NA_CATEGORY,partage_experience_symptome_non_NA_CATEGORY,soucis depuis moment
327,Vous arrivez à vous endormir avec le masque ?,recherche_information,traitement,non,NA_CATEGORY,recherche_information_traitement_non_NA_CATEGORY,arrivez endormir masque
552,"Finalement, on m'a aussi diagnostiqué comme étant narcoleptique.",partage_experience,diagnostique,non,NA_CATEGORY,partage_experience_diagnostique_non_NA_CATEGORY,finalement a aussi diagnostiqué comme narcoleptique
10,Résultat : Aucun changement,partage_experience,traitement,non,NA_CATEGORY,partage_experience_traitement_non_NA_CATEGORY,résultat aucun changement
896,"Et votre compagnon doit, à chaque fois qu'il rentre à la maison, se laver très soigneusement les mains, avec un gel hydro-alcoolique ou à défaut de l'eau et du savon.",partage_experience,diagnostique,non,NA_CATEGORY,partage_experience_diagnostique_non_NA_CATEGORY,compagnon doit chaque fois rentre maison laver très soigneusement main gel hydro alcoolique défaut eau savon
980,Combien de temps après l'arrêt d'une chimiothérapie les défenses immunitaires sont-elles restaurées ?,recherche_information,diagnostique,non,NA_CATEGORY,recherche_information_diagnostique_non_NA_CATEGORY,combien temp après arrêt chimiothérapie défenses immunitaires restaurées
218,"Je me rends compte que pour vous, ça a été le véritable parcours du combattant pour vous aider à vivre à peu près normalement !",partage_experience,traitement,non,NA_CATEGORY,partage_experience_traitement_non_NA_CATEGORY,rends compte a véritable parcours combattant aider vivre peu près normalement
645,je revais carrément que je m'étouffais donc je suppose qu'à ce moment bah je ne respirais plus!,partage_experience,symptome,oui,negatif,partage_experience_symptome_oui_negatif,revais carrément étouffais suppose moment bah respirais plus
45,Cela ne m'arrive que très rarement.,partage_experience,symptome,non,NA_CATEGORY,partage_experience_symptome_non_NA_CATEGORY,cela arrive très rarement
557,Est-ce que c'est possible que la machine donne de bons résultats alors qu'en fait elle marche mal???,recherche_information,traitement,non,NA_CATEGORY,recherche_information_traitement_non_NA_CATEGORY,possible machine donne bons résultats alors fait marche mal
812,"Le fait de rester confiné en étant malade chez soi m inquiète , nous sommes loin du système chinois qui a construit rapidement des hôpitaux .",partage_experience,traitement,oui,negatif,partage_experience_traitement_oui_negatif,fait rester confiné malade soi inquiète somme loin système chinois a construit rapidement hôpitaux
100,"Je fais des apnées du sommeil depuis un certain temps, je suis appareillé avec un masque nasal et depuis le mois de septembre au moment de m’endormir lorsque je fais la sieste ou le soir au coucher, j’ai la sensation d’étouffée, cela m’arrive une dizaine de fois avant de m’endormir, ensuite je dors très bien et n’es plus cette sensation.",partage_experience,symptome,oui,negatif,partage_experience_symptome_oui_negatif,fais apnées sommeil depuis certain temp appareillé masque nasal depuis mois septembre moment endormir lorsque fais sieste soir coucher sensation étouffée cela arrive dizaine fois avant endormir ensuite dors très bien e plus cette sensation
355,"La PPC reste le meilleur outil pour lever les apnées du sommeil, surtout dans les cas sévère.",partage_experience,traitement,non,NA_CATEGORY,partage_experience_traitement_non_NA_CATEGORY,ppc reste meilleur outil lever apnées sommeil surtout ca sévère
561,Cela vient peut-être d'autre chose.,partage_experience,diagnostique,non,NA_CATEGORY,partage_experience_diagnostique_non_NA_CATEGORY,cela vient peut être autre chose
759,Hello as tu déjà consulté un ophtalmologue ?,recherche_information,traitement,non,NA_CATEGORY,recherche_information_traitement_non_NA_CATEGORY,hello a déjà consulté ophtalmologue
531,"Tout est très bien, les apnées ont même diminué, je suis à 0.3 par heure.",partage_experience,symptome,non,NA_CATEGORY,partage_experience_symptome_non_NA_CATEGORY,tout très bien apnées diminué NUM NUM heure
795,"Ce ne sera pas la meilleure nuit ni la plus confortable, mais vous dormirez suffisamment pour que la collecte de données se fasse :)",partage_experience,diagnostique,oui,positif,partage_experience_diagnostique_oui_positif,serum pa meilleure nuit plus confortable dormirez suffisamment collecte données fasse EMOJI SMILE
646,c'est vraiment dur ca me fait peur alors quand je me reveille pour respirer je n'arrive plus à dormir parce que j'ai peur d'étouffer encore ..,partage_experience,symptome,oui,negatif,partage_experience_symptome_oui_negatif,vraiment dur ca fait peur alors quand reveille respirer arrive plus dormir parce peur étouffer encore
40,Salut à tous!,fonction_phatique,NA_CATEGORY,non,NA_CATEGORY,fonction_phatique_NA_CATEGORY_non_NA_CATEGORY,salut tous
94,"Puis, après 5 mois plus qu'horribles, épuisement total, la solution, d'une simplicité tellement incroyable que beaucoup ne me croiront pas.",partage_experience,symptome,oui,negatif,partage_experience_symptome_oui_negatif,puis après NUM mois plus horribles épuisement total solution simplicité tellement incroyable beaucoup croiront pa
81,"Bonjour, j'ai le même phénomène que vous !",partage_experience,symptome,non,NA_CATEGORY,partage_experience_symptome_non_NA_CATEGORY,bonjour phénomène
763,Avant tout se mettre à un régime alimentaire plus sain et voir votre médecin traitant pour en parler.,partage_experience,traitement,non,NA_CATEGORY,partage_experience_traitement_non_NA_CATEGORY,avant tout mettre régime alimentaire plus sain voir médecin traitant parler
79,Es-tu en surpoid ?,recherche_information,symptome,non,NA_CATEGORY,recherche_information_symptome_non_NA_CATEGORY,e surpoid
789,Merci d'avance,fonction_phatique,NA_CATEGORY,non,NA_CATEGORY,fonction_phatique_NA_CATEGORY_non_NA_CATEGORY,merci avance
379,"Résultat, hypopnees, et 150 micro réveils en une nuit ...",partage_experience,symptome,oui,negatif,partage_experience_symptome_oui_negatif,résultat hypopnees NUM micro réveils nuit
33,"Équipé depuis plusieurs années avec un appareil PPC, j ai commencé à ressentir des douleurs lombaires très fortes en fin de nuit (suffisamment forte pour me réveiller chaque jour à 4 heures du matin).",partage_experience,symptome,non,NA_CATEGORY,partage_experience_symptome_non_NA_CATEGORY,équipé depuis plusieurs années appareil ppc commencé ressentir douleurs lombaires très fortes fin nuit suffisamment forte réveiller chaque jour NUM heures matin
14,Résultat: Les douleurs du réveil semblent s'estomper …,partage_experience,traitement,non,NA_CATEGORY,partage_experience_traitement_non_NA_CATEGORY,résultat douleurs réveil semblent estomper
282,mais elle m’a conseillé d’en parler avec mon médecin traitant.,partage_experience,traitement,non,NA_CATEGORY,partage_experience_traitement_non_NA_CATEGORY,a conseillé parler médecin traitant
975,Merci d'avance pour vos réponses et bravo pour cette belle idée de forum.,fonction_phatique,NA_CATEGORY,oui,positif,fonction_phatique_NA_CATEGORY_oui_positif,merci avance réponses bravo cette belle idée forum
224,J'appréhende assez le fait qu'il me fasse quelques remontrances...,partage_experience,traitement,oui,negatif,partage_experience_traitement_oui_negatif,appréhende assez fait fasse quelques remontrances
207,"Vers 20 ans je commençais à avoir les symptômes des apnées (fatigue, maux de tête la matin), et on a réessayé de m'appareiller, sans succès encore.",partage_experience,symptome,non,NA_CATEGORY,partage_experience_symptome_non_NA_CATEGORY,vers NUM an commençais avoir symptômes apnées fatigue maux tête matin a réessayé appareiller succès encore
583,Le danger de mort n'est pas seulement pour l'apnéique puisqu'il commence à se dire qu'un tué sur trois sur la route serait du à un endormissement au volant et sans parler des blessés.,partage_experience,diagnostique,non,NA_CATEGORY,partage_experience_diagnostique_non_NA_CATEGORY,danger mort pa seulement apnéique puisqu commence dire tué trois route endormissement volant parler blessés
150,"Et comme je retire mon masque pendant que je dors, le lendemain, je suis crevée mais à un point !",partage_experience,symptome,oui,negatif,partage_experience_symptome_oui_negatif,comme retire masque pendant dors lendemain crevée point
453,J'ai un peu évolué depuis mon dernier message : toujurs impossible de m'endormir avec le masque facial (j'avais l'impression d'étouffer...),partage_experience,traitement,oui,negatif,partage_experience_traitement_oui_negatif,peu évolué depuis dernier message toujurs impossible endormir masque facial impression étouffer
750,- Changements (très) fréquents de position,partage_experience,symptome,non,NA_CATEGORY,partage_experience_symptome_non_NA_CATEGORY,changements très fréquents position
942,"Contexte : mon mari sort d'un ""épisode grippal"" : il n'a pas fait de test et son médecin lui a expliqué qu'il avait eu, peut-être, une forme atténuée de coronavirus ou d'une grippe classique.",partage_experience,symptome,non,NA_CATEGORY,partage_experience_symptome_non_NA_CATEGORY,contexte mari sort épisode grippal a pa fait test médecin a expliqué peut être forme atténuée coronavirus grippe classique
482,Merci de vos conseils si vous en avez,fonction_phatique,NA_CATEGORY,oui,positif,fonction_phatique_NA_CATEGORY_oui_positif,merci conseils si
866,"Tout dépend de vos défenses immunitaires, lesquelles peuvent être fragilisées durant une chimiothérapie.",partage_experience,diagnostique,non,NA_CATEGORY,partage_experience_diagnostique_non_NA_CATEGORY,tout dépend défenses immunitaires lesquelles peuvent être fragilisées durant chimiothérapie
194,"Alors, parfois, autant je me réveille avec le masque autant d'autres fois, je me réveille sans.",partage_experience,symptome,non,NA_CATEGORY,partage_experience_symptome_non_NA_CATEGORY,alors parfois autant réveille masque autant autres fois réveille
528,Merci pour vos conseils.,fonction_phatique,NA_CATEGORY,non,NA_CATEGORY,fonction_phatique_NA_CATEGORY_non_NA_CATEGORY,merci conseils
86,"A chaque fois, cela me réveil en sursaut, le coeur qui bat à tout rompre et je l'entend même dans les oreilles.",partage_experience,symptome,non,NA_CATEGORY,partage_experience_symptome_non_NA_CATEGORY,a chaque fois cela réveil sursaut coeur bat tout rompre entend oreilles
815,"On sait tout de même qu’elle se fait majoritairement par voie aérienne, via les postillons émis par la personne infectée.",partage_experience,diagnostique,non,NA_CATEGORY,partage_experience_diagnostique_non_NA_CATEGORY,sait tout fait majoritairement voie aérienne via postillons émis personne infectée
585,"D'autre part je n'avais pas connaissance que le fait d'etre appareillé pour ce syndrome puisse déclencher de la ""rigolade""",partage_experience,traitement,oui,positif,partage_experience_traitement_oui_positif,autre part pa connaissance fait etre appareillé syndrome puisse déclencher rigolade
127,Moi je ne dormais plus et je comptait les secondes ou il ne respirait plus.,partage_experience,symptome,oui,negatif,partage_experience_symptome_oui_negatif,dormais plus comptait secondes respirait plus
112,"Je n'ai que la solution d'expirer par la bouche, je sais qu'il faut respirer la bouche fermée mais j'étouffe.",partage_experience,symptome,oui,negatif,partage_experience_symptome_oui_negatif,solution expirer bouche sais faut respirer bouche fermée étouffe
243,"je rejoind l'avis d'aller consulter un neurologue, ça me fait un peu penser à une forme ""light"" de la narco",partage_experience,diagnostique,non,NA_CATEGORY,partage_experience_diagnostique_non_NA_CATEGORY,rejoind avis aller consulter neurologue fait peu penser forme light narco
181,Vous utilisez quel type de masque ?,recherche_information,traitement,non,NA_CATEGORY,recherche_information_traitement_non_NA_CATEGORY,utilisez quel type masque
305,"Ma tension a baissé, peut être est-ce la cause de cette fatigue ?",recherche_information,symptome,non,NA_CATEGORY,recherche_information_symptome_non_NA_CATEGORY,tension a baissé peut être cause cette fatigue
352,"Aussi il me propose de mettre un masque pour m'oxygéner la nuit seulement un de mes cousins, lui-même médecin à l'étranger nous avait fait savoir que cela est de l'arnaque aussi je suis assez embêté pour savoir que choisir en terme de traitement sachant que je suis très fatigué le matin et que cela a une influence sur mon diabète.",partage_experience,traitement,non,NA_CATEGORY,partage_experience_traitement_non_NA_CATEGORY,aussi propose mettre masque oxygéner nuit seulement cousin médecin étranger fait savoir cela arnaque aussi assez embêté savoir choisir terme traitement sachant très fatigué matin cela a influence diabète
614,J'ai touve une étude suisse qui dit qu'ils n'en ont pas observe mais il y a effectivement beaucoup de site qui le citent comme effet secondaire...,partage_experience,symptome,non,NA_CATEGORY,partage_experience_symptome_non_NA_CATEGORY,touve étude suisse dit pa observe a effectivement beaucoup site citent comme effet secondaire
228,"alors je prend une grande aspiration et là au bout de quelques secondes, tout redevient ( enfin "" je "" ) redeviens normal ...",partage_experience,symptome,non,NA_CATEGORY,partage_experience_symptome_non_NA_CATEGORY,alors prend grande aspiration là bout quelques secondes tout redevient enfin redeviens normal
748,Ce sont également les symptômes suivant qui m'ont fait penser à un potentiel problème d'ADS:,partage_experience,symptome,non,NA_CATEGORY,partage_experience_symptome_non_NA_CATEGORY,également symptômes suivant fait penser potentiel problème ad
533,Un réglage de l'appareil est peut-être nécessaire.,partage_experience,traitement,non,NA_CATEGORY,partage_experience_traitement_non_NA_CATEGORY,réglage appareil peut être nécessaire
684,Puis-vous demander si votre masque est Nasale ou Facial ?,recherche_information,traitement,non,NA_CATEGORY,recherche_information_traitement_non_NA_CATEGORY,puis demander si masque nasale facial
805,"Aussi, si les exercices aident un peu, mais qu'ils ne sont pas bien maîtrisés, ils vont peut-être mener à un résultat négatif au test de sommeil sans que votre problème soit réglé de façon permanente et adéquate pour autant.",partage_experience,traitement,non,NA_CATEGORY,partage_experience_traitement_non_NA_CATEGORY,aussi si exercices aident peu pa bien maîtrisés vont peut être mener résultat négatif test sommeil problème réglé façon permanente adéquate autant
459,Bien sur que cela va s'arranger et bientot quand tu verra les effets bénéfiques de la PPC tu deviendra accroc.,partage_experience,diagnostique,oui,positif,partage_experience_diagnostique_oui_positif,bien cela va arranger bientot quand verra effets bénéfiques ppc deviendra accroc
625,ce que je peux te dire c que j'ai une rampe de 30mn pr m'endormir pdt laquelle la pression est geree en fonction de mes inspirations.,partage_experience,traitement,non,NA_CATEGORY,partage_experience_traitement_non_NA_CATEGORY,peux dire rampe NUM mn pr endormir pdt laquelle pression geree fonction inspiration
602,"La premiere question que je me suis pose et que j'ai donc pose aux medecins est ""la VPPC qui m'envoie de l'air en continu ne serait-elle pas une cause possible de ce pneumothorax?""",recherche_information,diagnostique,non,NA_CATEGORY,recherche_information_diagnostique_non_NA_CATEGORY,premiere question pose pose medecins vppc envoie air continu pa cause possible pneumothorax
144,"Cette nuit j'ai bien dormi bien qu'elle fût quand même courte, cinq heures quarante cinq de sommeil.",partage_experience,symptome,non,NA_CATEGORY,partage_experience_symptome_non_NA_CATEGORY,cette nuit bien dormi bien quand courte cinq heures quarante cinq sommeil
123,"Bonjour, nouvelle sur ce forum j'espère pouvoir vous apporter quelques réponses.",partage_experience,diagnostique,oui,positif,partage_experience_diagnostique_oui_positif,bonjour nouvelle forum espère pouvoir apporter quelques réponses
22,Je suis appareillée depuis maintenant 5 mois et j'ai une recrudescence de mes douleurs au niveau des cervicales et haut du dos.,partage_experience,symptome,non,NA_CATEGORY,partage_experience_symptome_non_NA_CATEGORY,appareillée depuis maintenant NUM mois recrudescence douleurs niveau cervicales haut do
356,Votre ami vous a raconté n'importe quoi.,partage_experience,diagnostique,oui,negatif,partage_experience_diagnostique_oui_negatif,ami a raconté importe
315,"L'arrête de mon nez est rouge, gonflée et me fait mal.",partage_experience,symptome,non,NA_CATEGORY,partage_experience_symptome_non_NA_CATEGORY,arrête nez rouge gonflée fait mal
969,1) Je viens de terminer un cycle de 4 chimiothérapie + immunothérapie (le 12 avril).,partage_experience,traitement,non,NA_CATEGORY,partage_experience_traitement_non_NA_CATEGORY,NUM viens terminer cycle NUM chimiothérapie immunothérapie NUM avril
418,"Avant hier, nouveau RDV chez le cardio qui me dit qu’il me faut d’urgence porter un masque pour lutter contre les apnées du sommeil :",partage_experience,traitement,non,NA_CATEGORY,partage_experience_traitement_non_NA_CATEGORY,avant hier nouveau rdv cardio dit faut urgence porter masque lutter contre apnées sommeil
