ID,Sentences,niveau1,niveau2,niveau3_1,niveau3_2,combined_labels,Sentences_clean
836,La question qui me vient alors est : un dépistage ne doit il pas avoir lieu pour prévenir d un éventuel cas de covid 19?,recherche_information,traitement,non,NA_CATEGORY,recherche_information_traitement_non_NA_CATEGORY,question vient alors dépistage doit pa avoir lieu prévenir éventuel ca covid NUM
155,Moins dune heure ?,recherche_information,symptome,non,NA_CATEGORY,recherche_information_symptome_non_NA_CATEGORY,moins dune heure
601,"Ma morphologie est l'inverse des cas habituels puisque je pese 85kg pr 1,65m et que le pneumothorax touche plutot des personnes grandes et longilignes.",partage_experience,symptome,non,NA_CATEGORY,partage_experience_symptome_non_NA_CATEGORY,morphologie inverse ca habituels puisque pese NUM kg pr NUM NUM pneumothorax touche plutot personnes grandes longilignes
511,Il me semble avoir déja entendu parler ou lu sur internet d'appareillage pour enfant comme celui des adultes.,partage_experience,traitement,non,NA_CATEGORY,partage_experience_traitement_non_NA_CATEGORY,semble avoir déja entendu parler lu internet appareillage enfant comme adultes
649,"Voilà en gros mon problème : depuis 20 joursje suis appareillée pour apnées du sommeil, donc je dors avec PPC et masque nasal.",partage_experience,traitement,non,NA_CATEGORY,partage_experience_traitement_non_NA_CATEGORY,voilà gros problème depuis NUM joursje appareillée apnées sommeil dors ppc masque nasal
384,J’ai l’ impression de dormir profondément....,partage_experience,symptome,non,NA_CATEGORY,partage_experience_symptome_non_NA_CATEGORY,impression dormir profondément
311,"Bonjour, et merci pour votre réponse.",fonction_phatique,NA_CATEGORY,non,NA_CATEGORY,fonction_phatique_NA_CATEGORY_non_NA_CATEGORY,bonjour merci réponse
493,"Mon Orl m'a dit que toutes les apnées ne se traitent pas forcément avec l'ablation de amygdales, inuquement efficace pour les apnées obstructives (c'est a dire avec des éléments qui bouchent les voies aériennes : amygdales, végétations, cornets...)",partage_experience,diagnostique,non,NA_CATEGORY,partage_experience_diagnostique_non_NA_CATEGORY,orl a dit toutes apnées traitent pa forcément ablation amygdales inuquement efficace apnées obstructives a dire éléments bouchent voies aériennes amygdales végétations cornet
256,"Et le plus souvent, je prends l 'exemple de pbm d apnees du sommeil graves et non traitées, on trouve aussi chez les patients des pbm cardiovasculaires, notemment de tension...",partage_experience,diagnostique,non,NA_CATEGORY,partage_experience_diagnostique_non_NA_CATEGORY,plus souvent prends exemple pbm apnees sommeil graf non traitées trouve aussi patient pbm cardiovasculaires notemment tension
205,"Ils se sont rendus compte lors d'une polysomnographie et autres examens (je ne me rappelle pas des autres types désolé) que j'avais des apnées du sommeil moyennes (au dessus de la moyenne sans que ça soit sévère) et j'ai été appareillé vers mes 14-15 ans mais je retirais sans arrêt le masque, et je n'ai pas réussi à garder la machine.",partage_experience,diagnostique,non,NA_CATEGORY,partage_experience_diagnostique_non_NA_CATEGORY,rendus compte lors polysomnographie autres examen rappelle pa autres type désolé apnées sommeil moyennes dessus moyenne sévère appareillé vers NUM NUM an retirais arrêt masque pa réussi garder machine
470,à l'école elle commence a se déconcentrer elle est punit presque tout les jours car elle n'écoute pas ne tiens pas en place .....,partage_experience,symptome,oui,negatif,partage_experience_symptome_oui_negatif,école commence a déconcentrer punit presque tout jours écoute pa tiens pa place
721,Je ne voudrais pas vous décevoir mais lorsque j'avais posé la question: Combien de temps vais-je garder cette machine?,recherche_information,traitement,non,NA_CATEGORY,recherche_information_traitement_non_NA_CATEGORY,voudrais pa décevoir lorsque posé question combien temp vais garder cette machine
657,As tu essayé avec l'ajout d'un humidificateur sur la PPC?,recherche_information,traitement,non,NA_CATEGORY,recherche_information_traitement_non_NA_CATEGORY,a essayé ajout humidificateur ppc
96,"Pour faire simple, en trois jours, c'était terminé.",partage_experience,traitement,non,NA_CATEGORY,partage_experience_traitement_non_NA_CATEGORY,faire simple trois jours terminé
810,Bonsoir à tous .,fonction_phatique,NA_CATEGORY,non,NA_CATEGORY,fonction_phatique_NA_CATEGORY_non_NA_CATEGORY,bonsoir tous
433,j'étais au même taux d'apnée que toi.,partage_experience,traitement,non,NA_CATEGORY,partage_experience_traitement_non_NA_CATEGORY,taux apnée
624,Je pense que c'est CPAP mais je m'y connais pas trop.,partage_experience,traitement,non,NA_CATEGORY,partage_experience_traitement_non_NA_CATEGORY,pense cpap connais pa trop
863,Merci de votre réponse et de me dire quelles précautions je dois prendre.,fonction_phatique,NA_CATEGORY,non,NA_CATEGORY,fonction_phatique_NA_CATEGORY_non_NA_CATEGORY,merci réponse dire quelles précautions doi prendre
781,"Dans votre cas, il se peut que ce soit autre chose, mais un test de sommeil aidera à confirmer ou éliminer la possibilité d'un trouble de sommeil.",partage_experience,diagnostique,non,NA_CATEGORY,partage_experience_diagnostique_non_NA_CATEGORY,ca peut autre chose test sommeil aidera confirmer éliminer possibilité trouble sommeil
357,"Ce qui est inquiétant, c'est qu'il est médecin !",partage_experience,diagnostique,oui,negatif,partage_experience_diagnostique_oui_negatif,inquiétant médecin
424,"- et surtout il me parle (et je lui demande de confirmer) d’apnées qui dureraient 476 secondes, ce qui me semble complètement fou !!!",partage_experience,symptome,oui,negatif,partage_experience_symptome_oui_negatif,surtout parle demande confirmer apnées dureraient NUM secondes semble complètement fou
727,J'ai 24 ans.,partage_experience,symptome,non,NA_CATEGORY,partage_experience_symptome_non_NA_CATEGORY,NUM an
304,Je note que malgré le fait que je dors vraiment beaucoup mieux je suis nettement plus fatiguée depuis que j'utilise cet appareil et ça devient difficile à vivre.,partage_experience,symptome,non,NA_CATEGORY,partage_experience_symptome_non_NA_CATEGORY,note malgré fait dors vraiment beaucoup mieux nettement plus fatiguée depuis utilise cet appareil devient difficile vivre
469,"Depuis plusieurs semaine ma fille deviens plus difficile, n'écoute plus, court partout, saute et danse sans s'arrêtter bien qu'on le lui dise et même qu'on la gronde ...",partage_experience,symptome,oui,negatif,partage_experience_symptome_oui_negatif,depuis plusieurs semaine fille deviens plus difficile écoute plus court partout saute danse arrêtter bien dise gronde
197,Comment vous a-t-on diagnostiqué cela ?,recherche_information,diagnostique,non,NA_CATEGORY,recherche_information_diagnostique_non_NA_CATEGORY,comment a diagnostiqué cela
991,"Je n'ai pas vraiment envie d'appelé et ""déranger""mon médecin alors que d'autre personnes en ont s'en doute plus besoins au vu de la situation.",partage_experience,traitement,non,NA_CATEGORY,partage_experience_traitement_non_NA_CATEGORY,pa vraiment envie appelé déranger médecin alors autre personnes doute plus besoins vu situation
59,"Pour ma part je vais voir mon doc au milieu avril, je vais lui en parler.",partage_experience,traitement,non,NA_CATEGORY,partage_experience_traitement_non_NA_CATEGORY,part vais voir doc milieu avril vais parler
778,"En parallèle, je vois une physiothérapeute et fais des exercices de renforcement des muscles de la langue afin d'éviter qu'elle recule, ce qui a donné des bons résultats jusqu'à présent.",partage_experience,traitement,non,NA_CATEGORY,partage_experience_traitement_non_NA_CATEGORY,parallèle vois physiothérapeute fais exercices renforcement muscle langue afin éviter recule a donné bons résultats jusqu présent
213,"Je vous envoie le site avec l'oreiller en question par message privé, si ça vous intéresse.",partage_experience,traitement,non,NA_CATEGORY,partage_experience_traitement_non_NA_CATEGORY,envoie site oreiller question message privé si intéresse
407,"Même si sa date un peu, je voulais juste vous dire que moi même faisant de l'apnée du sommeil, mon médecin m'avais dit que si j'en faisais de jour (éveillé) c'est que la cause était cérébral ;)",partage_experience,diagnostique,non,NA_CATEGORY,partage_experience_diagnostique_non_NA_CATEGORY,si date peu voulais juste dire faisant apnée sommeil médecin dit si faisais jour éveillé cause cérébral EMOJI WINK
830,"En revanche, dans le cadre de protocoles de soins pour un cancer, il faut respecter les prescriptions de l'oncologue.",partage_experience,diagnostique,non,NA_CATEGORY,partage_experience_diagnostique_non_NA_CATEGORY,revanche cadre protocoles soins cancer faut respecter prescription oncologue
76,Il faut juste adopter une hygiène de vie un peu plus saine.,partage_experience,traitement,non,NA_CATEGORY,partage_experience_traitement_non_NA_CATEGORY,faut juste adopter hygiène vie peu plus saine
37,Mon pneumologue m’oriente aujourd’hui vers une solution d’orthèse mandibulaire.,partage_experience,traitement,non,NA_CATEGORY,partage_experience_traitement_non_NA_CATEGORY,pneumologue oriente aujourd hui vers solution orthèse mandibulaire
997,Le plus probable est que vous ayez eu une déchirure musculaire lors de ces exercices physiques intenses et que par la suite le stress ait amplifié votre symptomatologie.,partage_experience,diagnostique,non,NA_CATEGORY,partage_experience_diagnostique_non_NA_CATEGORY,plus probable déchirure musculaire lors exercices physique intenses suite stress amplifié symptomatologie
726,On m'a diagnostiqué une apnée centrale du sommeil sévère et on m'a prescrit une assistance respiratoire la nuit.,partage_experience,traitement,non,NA_CATEGORY,partage_experience_traitement_non_NA_CATEGORY,a diagnostiqué apnée centrale sommeil sévère a prescrit assistance respiratoire nuit
132,"Suivi en neurophysiologie, actuellement il ne fait plus d'apnée.",partage_experience,traitement,non,NA_CATEGORY,partage_experience_traitement_non_NA_CATEGORY,suivi neurophysiologie actuellement fait plus apnée
573,"j ai peur avant de me coucher en ce moment je crois que j'ai peur de faire des apnées et que ça ai empiré depuis et j'ai peur d'y rester j'en peux plus, je suis sans arret reveiller la nuit au moins une fois et il me faut 1 heure avant de me rendormir, je suis mort de trouille, j'ai deja appelé les secours",partage_experience,symptome,oui,negatif,partage_experience_symptome_oui_negatif,peur avant coucher moment crois peur faire apnées empiré depuis peur rester peux plus arret reveiller nuit moins fois faut NUM heure avant rendormir mort trouille deja appelé secours
522,"Les 3 premières semaines, j'étais en pleine forme mais depuis la fatigue est revenue, l'appareil n'a plus aucun effet sur ma fatigue.",partage_experience,symptome,non,NA_CATEGORY,partage_experience_symptome_non_NA_CATEGORY,NUM premières semaines pleine forme depuis fatigue revenue appareil a plus aucun effet fatigue
662,"Sauf que depuis 4/5 jours, je recommence à me réveiller la nuit avec du mal à me rendormir et je recommence à ronfler..",partage_experience,symptome,non,NA_CATEGORY,partage_experience_symptome_non_NA_CATEGORY,sauf depuis NUM NUM jours recommence réveiller nuit mal rendormir recommence ronfler
587,"..J'en doute, ou on vous à mal documenté!!!!!",partage_experience,traitement,oui,negatif,partage_experience_traitement_oui_negatif,doute mal documenté
551,"J'ai eu exactement le même problème, ça fait deux ans qu'on a diagnostiqué mon problème d'apnées du sommeil, mais ça ne s'améliorait pas vraiment, j'était toujours autant fatigué, je ne comprenais pas vraiment pourquoi.",partage_experience,symptome,non,NA_CATEGORY,partage_experience_symptome_non_NA_CATEGORY,exactement problème fait deux an a diagnostiqué problème apnées sommeil améliorait pa vraiment toujours autant fatigué comprenais pa vraiment pourquoi
421,Il dispose des résultats qu’il me commente de manière assez pessimiste :,partage_experience,traitement,non,NA_CATEGORY,partage_experience_traitement_non_NA_CATEGORY,dispose résultats commente manière assez pessimiste
402,"alors déja ,personne ne respire en apnée puisque des apnées c des arrêts respiratoires &amp; pour le problèmes d'arrêt respiratoire ,il faut aller voir un médecin &amp; lui en parler",partage_experience,diagnostique,non,NA_CATEGORY,partage_experience_diagnostique_non_NA_CATEGORY,alors déja personne respire apnée puisque apnées arrêts respiratoires amp problèmes arrêt respiratoire faut aller voir médecin amp parler
908,Se pourrait-il que le coronavirus n'ait qu'un impact faible sur lui même avec un système immunitaire diminué ?,recherche_information,symptome,non,NA_CATEGORY,recherche_information_symptome_non_NA_CATEGORY,pourrait coronavirus impact faible système immunitaire diminué
179,Bonsoir :),fonction_phatique,NA_CATEGORY,non,NA_CATEGORY,fonction_phatique_NA_CATEGORY_non_NA_CATEGORY,bonsoir EMOJI SMILE
166,"En ce moment j'aime bien mon masque actuel et j'en ai essayé pleins, il a des aimants en attache et c'est un ""bucco-nasale"" .",partage_experience,traitement,non,NA_CATEGORY,partage_experience_traitement_non_NA_CATEGORY,moment aime bien masque actuel essayé pleins a aimants attache bucco nasale
220,Tous ces tests que vous avez passés !,partage_experience,traitement,non,NA_CATEGORY,partage_experience_traitement_non_NA_CATEGORY,tous test passés
901,"Bien évidemment, ma mère depuis à souvent des glaires, du mucus qu'elle doit cracher pour bien ""libérer"" ses poumons, cela fait elle une personne à risque ?",recherche_information,diagnostique,non,NA_CATEGORY,recherche_information_diagnostique_non_NA_CATEGORY,bien évidemment mère depuis souvent glaires mucus doit cracher bien libérer poumons cela fait personne risque
316,"J'ai essayé les compresses, ça protège plus ou moins de la douleur mais c'est tout.",partage_experience,traitement,non,NA_CATEGORY,partage_experience_traitement_non_NA_CATEGORY,essayé compress protège plus moins douleur tout
742,"Mon réveil sonne, mais je suis tellement ""exténuée"" qu'il me semble impossible de me réveiller complètement.",partage_experience,symptome,oui,negatif,partage_experience_symptome_oui_negatif,réveil sonne tellement exténuée semble impossible réveiller complètement
202,Bonjour Jenny Parker :),fonction_phatique,NA_CATEGORY,oui,positif,fonction_phatique_NA_CATEGORY_oui_positif,bonjour jenny parker EMOJI SMILE
423,- des apnées de toutes sortes mais principalement parce que j’oublie de respirer (ça ne vient donc pas majoritairement de ma gorge si j’ai bien compris),partage_experience,symptome,non,NA_CATEGORY,partage_experience_symptome_non_NA_CATEGORY,apnées toutes sortes principalement parce oublie respirer vient pa majoritairement gorge si bien compris
691,J' ai déréglé ma machine et j' ai fait moi même mes réglagesque j' ai en quelque sorte imposé à mon nouveau médecin.,partage_experience,traitement,non,NA_CATEGORY,partage_experience_traitement_non_NA_CATEGORY,déréglé machine fait réglagesque quelque sorte imposé nouveau médecin
822,On nous prescrit en effet de la cortisone en cas de nausées et aussi avant certaine chimiothérapie.,partage_experience,traitement,non,NA_CATEGORY,partage_experience_traitement_non_NA_CATEGORY,prescrit effet cortisone ca nausées aussi avant certaine chimiothérapie
824,"Je m'inquiète aussi des contacts très rapprochés que nous avons avec le personnel de l'hôpital (lors des auscultations par exemple) et des laboratoires d’analyses sans aucun masque ni sur nous ni sur eux, alors que nous sommes fragiles.",partage_experience,traitement,non,NA_CATEGORY,partage_experience_traitement_non_NA_CATEGORY,inquiète aussi contact très rapprochés avon personnel hôpital lors auscultation exemple laboratoires analysis aucun masque alors somme fragiles
565,Il voit la pneumo demain.,partage_experience,traitement,non,NA_CATEGORY,partage_experience_traitement_non_NA_CATEGORY,voit pneumo demain
562,Je dois le rappeler cette semaine ...,partage_experience,traitement,non,NA_CATEGORY,partage_experience_traitement_non_NA_CATEGORY,doi rappeler cette semaine
62,Et des aliments gras?,recherche_information,symptome,non,NA_CATEGORY,recherche_information_symptome_non_NA_CATEGORY,aliment gras
449,"j'ai 32 ans, je suis une femme en surpoids en attente d'une operation bariatrique.",partage_experience,symptome,non,NA_CATEGORY,partage_experience_symptome_non_NA_CATEGORY,NUM an femme surpoids attente operation bariatrique
790,"Bonsoir, moi la nuit de l'enregistrement j'ai eu l'impression d'avoir fait une nuit blanche, pourtant aux vu de l'enregistrement j'ai dormi..",partage_experience,symptome,non,NA_CATEGORY,partage_experience_symptome_non_NA_CATEGORY,bonsoir nuit enregistrement impression avoir fait nuit blanche pourtant vu enregistrement dormi
264,"Grosse dépression et se qui s'en suit, le preuve je le vie.",partage_experience,symptome,oui,negatif,partage_experience_symptome_oui_negatif,grosse dépression suit preuve vie
337,J’ai envie de vous dire qu’il ne faut jamais perdre espoir.,partage_experience,diagnostique,oui,positif,partage_experience_diagnostique_oui_positif,envie dire faut jamais perdre espoir
161,je vais voir comment se passe ma nuit à venir...,partage_experience,symptome,non,NA_CATEGORY,partage_experience_symptome_non_NA_CATEGORY,vais voir comment passe nuit venir
177,"Aussi, j'ai décidé de le scotcher également.",partage_experience,traitement,non,NA_CATEGORY,partage_experience_traitement_non_NA_CATEGORY,aussi décidé scotcher également
129,Il est néanmoins devenu très sensible aux rhinites.,partage_experience,symptome,non,NA_CATEGORY,partage_experience_symptome_non_NA_CATEGORY,néanmoins devenu très sensible rhinites
244,"tout cela ne me rassure guère ^^, je vais aller voir un neuro ..par contre pour ce qui est de la narcoleptie, je ne pense pas, car je suis complètement réveillé, je suis juste ""trop"" concentré , en aucun cas je dors ou autre , et je me souviens à chaque fois de ce qui se passe ,merci pour vos réponses si rapides",partage_experience,symptome,oui,negatif,partage_experience_symptome_oui_negatif,tout cela rassure guère vais aller voir neuro contre narcoleptie pense pa complètement réveillé juste trop concentré aucun ca dors autre souviens chaque fois passe merci réponses si rapides
367,En attendant un rdv à sa clinique il m'a mis sous amoxicilline/acide clavulanique 1 g/125 mg que j'ai abandonné sur les conseils de mon médecin traitant au bout de 3 jours because aphtes+langue qui double de volume+diarrhées malgré ultra levure.,partage_experience,traitement,oui,negatif,partage_experience_traitement_oui_negatif,attendant rdv clinique a mi sou amoxicilline acide clavulanique NUM g NUM mg abandonné conseils médecin traitant bout NUM jours because aphtes langue double volume diarrhées malgré ultra levure
60,Consommez-vous beaucoup de produits avec de la caféine?,recherche_information,symptome,non,NA_CATEGORY,recherche_information_symptome_non_NA_CATEGORY,consommez beaucoup produits caféine
823,Pour ma part je prends du prednisone avant chaque chimiothérapie hebdomadaire de Taxol.,partage_experience,traitement,non,NA_CATEGORY,partage_experience_traitement_non_NA_CATEGORY,part prends prednisone avant chaque chimiothérapie hebdomadaire taxol
419,Je fais 75 apnées à l’heure alors que la norme maxi serait de 30…,partage_experience,symptome,non,NA_CATEGORY,partage_experience_symptome_non_NA_CATEGORY,fais NUM apnées heure alors norme maxi NUM
577,"Non, je ne pense pas que l'on puisse mourir de l'apnée du sommeil car une apnée trop importante (longue) déclenche des alarmes dnas le cerveau et lui commande de te réveiller pour que tu puisses penser à respirer au moins par la bouche.",partage_experience,diagnostique,non,NA_CATEGORY,partage_experience_diagnostique_non_NA_CATEGORY,non pense pa puisse mourir apnée sommeil apnée trop importante longue déclenche alarmes dna cerveau commande réveiller puisses penser respirer moins bouche
628,Donc tu a une APAP réglée de 6 a 16.,partage_experience,traitement,non,NA_CATEGORY,partage_experience_traitement_non_NA_CATEGORY,a apap réglée NUM a NUM
697,"Et dans ce cas, modifier les réglages peut même s'avérer dangereux.",partage_experience,diagnostique,oui,negatif,partage_experience_diagnostique_oui_negatif,ca modifier réglages peut avérer dangereux
862,J'ai 32 ans et n'ai pas encore fait mon irm et tep scan de contrôle.,partage_experience,traitement,non,NA_CATEGORY,partage_experience_traitement_non_NA_CATEGORY,NUM an pa encore fait irm tep scan contrôle
553,C'est peut-être votre cas.,partage_experience,diagnostique,non,NA_CATEGORY,partage_experience_diagnostique_non_NA_CATEGORY,peut être ca
342,"Mon nez, lui, n’apprécie pas vraiment le contact du masque et était très douloureux les premiers jours, un peu moins maintenant mais quand même encore.",partage_experience,symptome,oui,negatif,partage_experience_symptome_oui_negatif,nez apprécie pa vraiment contact masque très douloureux premier jours peu moins maintenant quand encore
397,"Je m'explique : lorsqu'elle est concentrée, devant la tv, en cours ou autre, elle cesse de respirer pour reprendre et cela par intermitence.",partage_experience,symptome,non,NA_CATEGORY,partage_experience_symptome_non_NA_CATEGORY,explique lorsqu concentrée devant tv cours autre cesse respirer reprendre cela intermitence
167,"Mais j'ai préféré l'attache d'un ancien 100% nasale que j'avais mis sa sangle sur un autre, d'ailleurs le technicien n'avait pas compris pourquoi la sangle ne correspondait pas à celle d'origine.",partage_experience,traitement,non,NA_CATEGORY,partage_experience_traitement_non_NA_CATEGORY,préféré attache ancien NUM nasale mi sangle autre ailleurs technicien pa compris pourquoi sangle correspondait pa celle origine
764,"Bonjour à tous,",fonction_phatique,NA_CATEGORY,non,NA_CATEGORY,fonction_phatique_NA_CATEGORY_non_NA_CATEGORY,bonjour tous
500,"Liline, oui je connait la différence entre apnnées obstructives (le systeme respiratoire fonctionne mais l'air ne passe pas = obstruction) et l'apnée cenrtal (le système respiratoire s'arrêtte totalement= pas d'effort respiratoire)",partage_experience,diagnostique,non,NA_CATEGORY,partage_experience_diagnostique_non_NA_CATEGORY,liline oui connait différence entre apnnées obstructives systeme respiratoire fonctionne air passe pa obstruction apnée cenrtal système respiratoire arrêtte totalement pa effort respiratoire
711,"Ce qui m'avait amené à consulter mon généraliste, une fois ma semaine de travail terminée.",partage_experience,traitement,non,NA_CATEGORY,partage_experience_traitement_non_NA_CATEGORY,amené consulter généraliste fois semaine travail terminée
665,J'ai moi aussi une OAM mais j'ai diminué la propulsion à cause de la pression sur les dents.,partage_experience,symptome,non,NA_CATEGORY,partage_experience_symptome_non_NA_CATEGORY,aussi oam diminué propulsion cause pression dent
695,Il n'y a pas de paramètres de fréquence sur les CPAP.,partage_experience,diagnostique,non,NA_CATEGORY,partage_experience_diagnostique_non_NA_CATEGORY,a pa paramètres fréquence cpap
610,"Je suis donc à la recherche de témoignages, retours d'experience de quelqu'un qui aurait vécu le meme genre d'experience.",recherche_information,symptome,non,NA_CATEGORY,recherche_information_symptome_non_NA_CATEGORY,recherche témoignages retours experience quelqu vécu meme genre experience
765,"J'ai 32 ans et voilà que depuis 3 jours je bloque systématiquement ma respiration à l'endormissement, du coup je me reveille en sursaut et je me retrouve ainsi dans l'impossibilité totale de trouver le sommeil !",partage_experience,symptome,oui,negatif,partage_experience_symptome_oui_negatif,NUM an voilà depuis NUM jours bloque systématiquement respiration endormissement coup reveille sursaut retrouve ainsi impossibilité totale trouver sommeil
160,"J'ai changé le filtre de la machine (il était noir, c'est dingue !) et même tout changé avec un masque neuf parce que le petit filtre sous le masque était noir aussi.",partage_experience,traitement,non,NA_CATEGORY,partage_experience_traitement_non_NA_CATEGORY,changé filtre machine noir dingue tout changé masque neuf parce petit filtre sou masque noir aussi
885,Mon compagnon continue de travailler dans son usine qui n'a pas fermé.,partage_experience,symptome,non,NA_CATEGORY,partage_experience_symptome_non_NA_CATEGORY,compagnon continue travailler usine a pa fermé
122,J'en ai parlé aussi au psychiatre et il ne comprends non plus.,partage_experience,traitement,non,NA_CATEGORY,partage_experience_traitement_non_NA_CATEGORY,parlé aussi psychiatre comprends non plus
639,"Mais il ne me prenait pas vraiment au sérieux car je n'ai que 24 ans, que je suis svelte et non fumeuse...",partage_experience,symptome,oui,negatif,partage_experience_symptome_oui_negatif,prenait pa vraiment sérieux NUM an svelte non fumeuse
314,Qui peut me dire comment protéger mon nez correctement avec un masque nasal ?,recherche_information,traitement,non,NA_CATEGORY,recherche_information_traitement_non_NA_CATEGORY,peut dire comment protéger nez correctement masque nasal
121,Peut être que c'est psychologique.,recherche_information,diagnostique,non,NA_CATEGORY,recherche_information_diagnostique_non_NA_CATEGORY,peut être psychologique
586,pas d'accord mon commandant..souffrez-vous apnée du sommeil?,recherche_information,symptome,non,NA_CATEGORY,recherche_information_symptome_non_NA_CATEGORY,pa accord commandant souffrez apnée sommeil
